"Y8RQCDGR","book","1657","Schott, Caspar","Magia universalis naturæ et artis: sive, Recondita naturalium & artificialium rerum scientia, cujus ope per variam applicationem activorum cum passivis, admirandorum effectuum spectacula, abditarumque inventionum miracula, ad varios humanæ vitæ usus, eruuntur","","","","","","","1657","2020-08-31 13:40:24","2020-11-30 09:11:05","","","","","1","4","","Magia universalis","","","","","Henricus Pigrin","Herbipoli","German","","","","","Open WorldCat","","Herbipoli, Excudebat Iobus Hertz Typographus Herbipolensis, Anno M. DC. LVII.","","","https://books.google.it/books?id=6zZbBv2qEZ0C&dq=intitle:Magia+universalis+natur%C3%A6+et+artis+1657&as_brr=3&redir_esc=y&hl=it","Magie; Jesuiten; Schott; DB; TR_LAYOUT; TR_ONTR; TR_TRANSCRIPTION; Z_METADATA; ONLINE","","","","","","","","","","","","","","","","","","","","","","","","","","","","","","","","","","","","","","","","","","","","","","",""
"V7BLHV8R","book","1613","Ridley, Mark","A short treatise of Magneticall Bodies and Motions.","","","","","","","1613","2020-08-31 13:40:24","2020-11-26 14:35:25","","","","","","","","A short treatise","","","","","Nicholas Okes","London","English","","","","","Open WorldCat","","London Printed by Nicholas Okes. 1613.","","","https://www.e-rara.ch/i3f/v20/4578785/manifest","Mathematik; Physik; England; Kausalität; Galileo; Magnet; Gilbert; Navigation; Coitio; Ridley; Abweichung; Anziehung; Meridian; Tabelle; Inklination; TR_LAYOUT; TR_ONTR; TR_TRANSCRIPTION; Z_METADATA; Z_PRIORITY; TR_IMAGESELECTION; IIIF; ONLINE","","","","","","","","","","","","","","","","","","","","","","","","","","","","","","","","","","","","","","","","","","","","","","",""
"443KI4J9","book","1617","Ridley, Mark","Magneticall Animadversions","","","","","","","1617","2020-08-31 13:40:24","2020-11-26 14:40:55","","","","","","","","Magneticall Animadversions","","","","","Nicholas Okes","London","English","","","","","Open WorldCat","","London, Printed by Nicholas Okes. 1617.","","","https://search.proquest.com/docview/2248564335?accountid=104321","England; Magnet; Ridley; Barlow; DB; TR_LAYOUT; TR_ONTR; TR_TRANSCRIPTION; Z_METADATA; Z_PRIORITY; TR_IMAGESELECTION; ONLINE","","","","","","","","","","","","","","","","","","","","","","","","","","","","","","","","","","","","","","","","","","","","","","",""
"3BZCYBC3","book","1643","Fournier, Georges","Hydrographie contenant la théorie et la practique de toutes les parties de la navigation.","","","","","","","1643","2020-08-31 13:40:24","2020-11-26 15:06:38","2014-10-07 08:56:43","","","","","","","Hydrographie","","","","","Michel Soly","Paris","French","","","","","Open WorldCat","","A Paris, Chez Michel Soly, ruë Saint Jacques au Phoenix. M.DC.XLIII. Avec privilege du Roy.","","","https://api.digitale-sammlungen.de/iiif/presentation/v2/bsb10933977/manifest","Jesuiten; Navigation; Kompass; Instrument; Abweichung; Meridian; Fournier; ausgedruckt; Amalfi; Plautus; Erfindung; Handbuch; Inklination; Nautonier; Messwerte; TR_LAYOUT; TR_ONTR; TR_TRANSCRIPTION; Z_METADATA; TR_IMAGESELECTION; Z_PRIORITY2; IIIF; ONLINE","","","","","","","","","","","","","","","","","","","","","","","","","","","","","","","","","","","","","","","","","","","","","","",""
"B4RL6FVK","book","1667","Fournier, Georges","Hydrographie contenant la theorie et la pratique de toutes les parties de la navigation.","","","","","","","1667","2020-08-31 13:40:24","2020-11-30 09:33:35","","","","","","","","Hydrographie","","","","","Iean du Puis","Paris","French","","","","","Open WorldCat","","Paris, Chez Iean du Puis, ruë Sain Jacques, à la Couronne d'or. M.DC. LXVII. Avec privilege du roy.","","","https://api.digitale-sammlungen.de/iiif/presentation/v2/bsb10933978/manifest","Jesuiten; Übersetzung; Navigation; Kompass; Instrument; Fournier; TR_LAYOUT; TR_ONTR; TR_TRANSCRIPTION; Z_METADATA; TR_IMAGESELECTION; IIIF; ONLINE","","","","","","","","","","","","","","","","","","","","","","","","","","","","","","","","","","","","","","","","","","","","","","",""
"EADBZGZ4","book","1603","Nautonier, Guillaume de","The mecographie of ye loadstone","","","","","","","1603","2020-08-31 13:40:24","2020-11-26 14:28:35","2014-10-07 08:53:30","","","","","","","The mecographie of ye loadstone","","","","","Raimond Colomies; Antoine de Courteneusue","Toulouse; Vénès","English","","","","","Open WorldCat","","issued: 1603/1604. par Raimond Colomies, imprimeur en l'Vniuersitié de Tolose, & par Antoine de Courteneusue, aux frais de l'autheur- Imprimé à Tolose, & à Venez.","","","https://search.proquest.com/docview/2240894035/fulltextPDF/8F298799919D4E53PQ/1?accountid=104321","Mathematik; England; Navigation; Kompass; Instrument; Abweichung; Tabelle; Nautonier; DB; TR_LAYOUT; TR_ONTR; TR_TRANSCRIPTION; Z_METADATA; ONLINE","","","","","","","","","","","","","","","","","","","","","","","","","","","","","","","","","","","","","","","","","","","","","","",""
"Y7Z3DF9K","book","1717","Mercati, Michele","Metallotheca opus posthumum, Auctoritate, & magnificentia Clementis undecimi Pontificis maximi E tenebris in lucem eductum;","","","","","","","1717","2020-08-31 13:40:24","2020-11-30 09:51:54","","","","","","","","Metallotheca","","","","","Jo Mariae Salvioni","Rome","Latin","","","","","Open WorldCat","","Romæ MDCCXVII. Ex officina Jo Mariae Salvioni Romani in Archigymnasio Sapientiae. Superior facultate.","","","https://archive.org/details/MichaelisMercatiSamminiatensisMetallothecaOpusPosthumumAuctoritate/mercati-m-metallotheca-1717-RTL014971-LowRes","Physik; Fracastoro; Abbildung; Polarität; Lapidarium; Reisebericht; Metall; calamita biancha; ausgedruckt; Mohammed; DB; TR_LAYOUT; TR_ONTR; TR_TRANSCRIPTION; Z_METADATA; TR_IMAGESELECTION; ONLINE","","Assalti, Pietro; Lancisi, Giovanni Maria","","","","","","","","","","","","","","","","","","","","","","","","","","","","","","","","","","","","","","","","","","","","",""
"ZSKSJF6M","book","1653","Maignan, Emmanuel","Pars secunda philosophiae naturae","","","","","","","1653","2020-08-31 13:40:24","2020-11-27 08:59:50","","","","","","","","Emanuelis Maignan Cursus philosophicus","Cursus philosophicus: concinnatus ex notissimis cuiusque principiis","3","","","Bosc","Toulouse","Latin","","","","","Open WorldCat","","Tolosae, Apud Raymundum Bosc, M. DC. LIII. Cum Privilegio Regis.","","","https://books.google.it/books?id=uOYPdO1P7o8C&pg=PA1093&dq=Pars+secunda+philosophiae+naturae+1653+Maignan&hl=it&sa=X&ved=2ahUKEwip9qOjhq_sAhXSEcAKHZ5BCmwQ6AEwAHoECAMQAg#v=onepage&q=Pars%20secunda%20philosophiae%20naturae%201653%20Maignan&f=false","Aristoteles; Physik; Descartes; Rezeption; Cursus; Maignan; DB; TR_LAYOUT; TR_ONTR; TR_TRANSCRIPTION; Z_METADATA; ONLINE","","","","","","","","","","","","","","","","","","","","","","","","","","","","","","","","","","","","","","","","","","","","","","",""
"4C26N295","book","1565","Maggi, Lucilio; Aristoteles","In IIII libros Aristotelis, De cælo & Mundo, commentarij. Unà cum eorundem librorum è Cræco in Latinum per eundem conversione.","","","","","","","1565","2020-08-31 13:40:24","2020-11-26 13:09:32","","","","","","","","In IIII libros Aristotelis, De cælo & Mundo, commentarij.","","","","","Vincentium Valgrisium","Venice","Latin","","","","","Open WorldCat","","Venetiis, MDLXV. apud Vincentium Valgrisium","","","https://api.digitale-sammlungen.de/iiif/presentation/v2/bsb10195470/manifest","sphaera activitatis; Aristoteles; Physik; Astrologie; Navigation; Kompass; Kosmologie; Abbildung; Polarität; Instrument; Sphaera; Kommentar; TR_LAYOUT; TR_ONTR; TR_TRANSCRIPTION; Z_METADATA; TR_IMAGESELECTION; IIIF; ONLINE","","","","","","","","","","","","","","","","","","","","","","","","","","","","","","","","","","","","","","","","","","","","","","",""
"3CQI44XP","book","1668","Léotaud, Vincent","Magnetologia; in qua exponitur nova de magneticis philosophia.","","","","","","","1668","2020-08-31 13:40:24","2020-12-18 10:30:09","","","","","","","","Magnetologia","","","","","Laurentii Anisson","Lugduni","Latin","","","","","Open WorldCat","","Lugduni, Sumptibus Laurentii Anisson. M. DC. LXVIII. Cum privilegio regis.","","","https://www.e-rara.ch/i3f/v20/9407014/manifest","Cabeo; Magnet; Jesuiten; Kircher; Ismus; Z_METADATA; IIIF; ONLINE","","","","","","","","","","","","","","","","","","","","","","","","","","","","","","","","","","","","","","","","","","","","","","",""
"9UY6ZQ6J","book","1717","Leonardi, Camillo; Arlensis de Scudalupis, Petrus; Albinius, Petrus Constantius (Villanovensis)","Speculum lapidum, et D. Petri Arlensis de Scudalupis Presbyteri Hierosolymitani, Sympathia septem metallorum ac septem selectorum lapidum ad planetas","","","","","","","1717","2020-08-31 13:40:24","2020-12-17 14:38:00","","","","","","","","Speculum lapidum","","","","","Christianum Liebezeit","Hamburg","Latin","","","","","Open WorldCat","","Hamburgi Apud Christianum Liebezeit, 1717.","","","https://books.google.it/books?id=LJFaAAAAcAAJ&dq=intitle:Speculum+lapidum,+et+D.+Petri+Arlensis+1717&as_brr=3&redir_esc=y&hl=it","Magie; Technik; Hermetik; Alchemie; Astrologie; Telegraph; Kompass; Analogie; Porta; Polarität; Lapidarium; Skepsis; Amulett; Abweichung; Leonardi; Balenus; DB; TR_LAYOUT; TR_ONTR; TR_TRANSCRIPTION; TR_IMAGESELECTION; ONLINE","","","","","","","","","","","","","","","","","","","","","","","","","","","","","","","","","","","","","","","","","","","","","","",""
"3H328LJL","book","1667","Kircher, Athanasius","Magneticum naturae regnum, sive, Disceptatio physiologica de triplici in natura rerum magnete, juxta triplicem ejusdem naturae gradum digesto: inanimato, animato, sensitivo","","","","","","","1667","2020-08-31 13:40:24","2020-11-27 09:03:06","","","","","","","","Magneticum naturae regnum","","","","","Ignatii de Lazaris","Rome","Latin","","","","","Open WorldCat","","Romae, Typis Ignatij de Lazaris. 1667. Sup. Permissit.","","","https://api.digitale-sammlungen.de/iiif/presentation/v2/bsb10058478/manifest","Magnet; Jesuiten; Kircher; TR_LAYOUT; TR_ONTR; TR_TRANSCRIPTION; Z_METADATA; TR_IMAGESELECTION; IIIF; ONLINE","","","","","","","","","","","","","","","","","","","","","","","","","","","","","","","","","","","","","","","","","","","","","","",""
"BY64FZ2J","book","1596","Gallucci, Giovanni Paolo","Nova fabricandi horaria, mobilia et permanentia, tam acv magnetico: qvam sine acv ad omnem latitudinem, ratio nuper excogitata; et nunca primum in lucem edita.","","","","","","","1596","2020-08-31 13:40:24","2020-11-26 14:06:33","","","","","","","","Nova fabricandi horaria","","","","","Bernardum Basam","Venice","Latin","","","","","Open WorldCat","","Venetiis MDXCVI. Apud Bernardum Basam, ad Solis insigne.","","","https://api.digitale-sammlungen.de/iiif/presentation/v2/bsb10147825/manifest","Mathematik; Technik; Magnet; Kompass; Instrument; Abweichung; Uhr; Sonnenuhr; Meridian; Handbuch; TR_LAYOUT; TR_ONTR; TR_TRANSCRIPTION; Z_METADATA; TR_IMAGESELECTION; IIIF; ONLINE","","","","","","","","","","","","","","","","","","","","","","","","","","","","","","","","","","","","","","","","","","","","","","",""
"2RQWSL4N","book","1623","Fludd, Robert","Sectionis primae portio tertia De anatomia triplici: in partes tres divisa.","","","","","","","1623","2020-08-31 13:40:24","2020-11-26 14:45:17","","","","","","","","De anatomia triplici","","","","","Iann Theodor De Bry","Frankfurt","Latin","","","","","Open WorldCat","","Francofurti, Ex Typographia Erasmi Kempfferl Sumptibus Ioan. Theodor. de Bry. Anno M.DC.XXIII.","","","https://api.digitale-sammlungen.de/iiif/presentation/v2/bsb11069402/manifest","Magie; Sympathie; Medizin; Okkult; Technik; Waffensalbe; Paracelsus; Fludd; Telegraph; Porta; Blut; Instrument; calamita biancha; TR_LAYOUT; TR_ONTR; TR_TRANSCRIPTION; Z_METADATA; TR_IMAGESELECTION; IIIF; ONLINE","","","","","","","","","","","","","","","","","","","","","","","","","","","","","","","","","","","","","","","","","","","","","","",""
"VGS426WD","book","1636","Ens, Caspar","Thaumaturgus mathematicus, id est, Admirabilium effectorum e mathematicarum disciplinarum fontibus profluentium sylloge.","","","","","","","1636","2020-08-31 13:40:24","2020-11-26 14:53:25","","","","","","","","Thaumaturgus mathematicus","","","","","Constantinm Münich","Cologne","Latin","","","","","Open WorldCat","","Coloniae, Apud Constantinum Munich, Anno 1636. Cum specialis Gratia & Privilegio S. C. M.","","","https://www.e-rara.ch/i3f/v20/4410113/manifest","Mathematik; Magie; Technik; Wunder; Kircher; Navigation; Telegraph; Maschine; Populär; Disziplinen; Mohammed; Leurechon; TR_LAYOUT; TR_ONTR; TR_TRANSCRIPTION; Z_METADATA; TR_IMAGESELECTION; IIIF; ONLINE","","","","","","","","","","","","","","","","","","","","","","","","","","","","","","","","","","","","","","","","","","","","","","",""
"YY4EQ4UQ","book","1690","Dechales, Claudius Franciscus Milliet","Cursus seu mundus mathematicus Tomus primus","","","","","","","1690","2020-08-31 13:40:24","2020-11-27 09:06:14","","","","","","","","Cursus seu mundus","","","","","Anissonios;  Joan Posuel; Claud Rigaud","Lugduni","Latin","","","","","Open WorldCat","","Lugduni, Apud Anissonios, Joan Posuel, Claud Rigaud. M. DC. LXXXX. Cum privilegio regis.","","; ","https://books.google.it/books?id=3NNs7i-vC0QC&dq=inauthor:Dechales+1690&as_brr=3&redir_esc=y&hl=it; https://www.e-rara.ch/i3f/v20/2518348/manifest","Physik; Jesuiten; Experiment; Rezeption; Cursus; DB; TR_LAYOUT; TR_ONTR; TR_TRANSCRIPTION; Z_METADATA; TR_IMAGESELECTION; IIIF; ONLINE","","","","","","","","","","","","","","","","","","","","","","","","","","","","","","","","","","","","","","","","","","","","","","",""
"N6KLL5EN","book","1663","Cardano, Gerolamo","Opera Omnia: Tam Hactenus excusa; hic tamen aucta & emendata; quam nunquam alias visa, ac primum ex Auctoris ipsius Autographis eruta","","","","","","http://www.cardano.unimi.it/testi/opera.html","1663","2020-08-31 13:40:24","2020-11-30 09:32:52","","","","","","10","","Opera omnia","","","","","Ioannis Antonii Huguetan; Marci Antonii Ravaud","Lugduni","Latin","","","","","Open WorldCat","","Lugduni, Sumptibus Ioannis Antonii Huguetan & Marci Antonii Ravaud, M. DC: LXIII. Cum privilegium regis.","","","http://kvk.bibliothek.kit.edu/view-title/index.php?katalog=ARCHIVE_ORG&url=http%3A%2F%2Farchive.org%2Fdetails%2Fbub_gb_npDfaPp-3Y0C&signature=JCS7JXeWwiRcrhLyKj2QlyUJYjlFAu28N11bLMKWWtU&showCoverImg=1","Physik; Bewegung; Magie; Medizin; Technik; Astrologie; Cardano; Knoblauch; Polarität; Lapidarium; Geheimnis; Amulett; Instrument; Abweichung; Perpetuum mobile; Meridian; ausgedruckt; Werkausgabe; DB; TR_LAYOUT; TR_ONTR; TR_TRANSCRIPTION; Z_METADATA; TR_IMAGESELECTION; ONLINE","","","","","","","","","","","","","","","","","","","","","","","","","","","","","","","","","","","","","","","","","","","","","","",""
"BN3XZCDQ","book","1603","Plinius, Basilius","Carmen De Magnete","","","","","","","1603","2020-08-31 13:40:24","2020-11-26 14:28:51","","","","","","","","Carmen","","","","","Davidis Franci","Ausburg","Latin","","","","","Open WorldCat","","Augustae Vindelicorum, Typis Davidis Franci. M.DCIII.","","","https://api.digitale-sammlungen.de/iiif/presentation/v2/bsb10770189/manifest","Literatur; Magnet; Analogie; Poesie; TR_LAYOUT; TR_ONTR; TR_TRANSCRIPTION; Z_METADATA; IIIF; ONLINE","","","","","","","","","","","","","","","","","","","","","","","","","","","","","","","","","","","","","","","","","","","","","","",""
"8JJJDFUN","book","1618","Barlow, William","Magneticall advertisements: or Divers pertinent observations, and approved experiments, concerning the natures and properties of the load-stone Very pleasant for knowledge, and most needfull for practise, of travelling, or framing of instruments fit for travellers both by sea and land. Whereunto is anexed a breife discoverie of the idle animadversions of Mark Ridley Dr. in Physicke, upon a treatise entituled Magneticall advertisements","","","","","","","1618","2020-08-31 13:40:24","2020-11-26 14:41:34","2014-10-01 14:47:00","","","","","","","Magneticall advertisements","","","","","Edward Griffin","London","English","","","","","Open WorldCat","","London, Printed by Edwards Griffin for Timothy Barlow, and are to be fold at his shop in pauls Church-yards, at the signe of Time. 1618.","","","https://search.proquest.com/docview/2240951828?accountid=104321","England; Magnet; Kopernikus; Gilbert; Navigation; Kompass; Ridley; Barlow; DB; TR_LAYOUT; TR_ONTR; TR_TRANSCRIPTION; Z_METADATA; Z_PRIORITY; TR_IMAGESELECTION; ONLINE","","","","","","","","","","","","","","","","","","","","","","","","","","","","","","","","","","","","","","","","","","","","","","",""
"5HLXVTJ2","book","1683","Le Grand, Antoine","Institutio philosophiae, secundum principia D. Renati Descartes: nova methodo adornata, & explicata: in usum juventutis academicae.","","","","","","","1683","2020-08-31 13:40:24","2020-11-30 09:37:23","","","","","","","","Institutio philosophiae, secundum principia D. Renati Descartes","","","","","Johannis Ziegeri; Johannis Michaelis Spörlinii","Nuremberg","Latin","","","","","Open WorldCat","","Norimbergae, Imensis Johannis Ziegeri, Bibliopolae, Typis Johannis Michaelis Sporlini, MDCLVVVIII","","","https://books.google.it/books?id=NCU_AAAAcAAJ&dq=intitle:Institutio+philosophiae,+secundum+principia+D.+Renati+Descartes:+nova+methodo+adornata,+%26+explicata:+in+usum+juventutis+academicae.+1683&as_brr=3&redir_esc=y&hl=it","Physik; Descartes; Mechanik; Abbildung; Deutschland; Rezeption; DB; TR_LAYOUT; TR_ONTR; TR_TRANSCRIPTION; Z_METADATA; TR_IMAGESELECTION; ONLINE","","","","","","","","","","","","","","","","","","","","","2","","","","","","","","","","","","","","","","","","","","","","","","","",""
"EWUFISW8","book","1609","Boodt, Anselmus de","Gemmarum et lapidum historia qua non solum ortus, natura, vis & precium, sed etiam modus quo ex iis olea, salia, tincturae, essentiae, arcana & magisteria arte chymica confici possint, ostenditur: opus principibus, medicis, chymicis, physicis, ac liberalioribus ingeniis utilissimum: cum variis figuris, indiceq. duplici & copioso","","","","","","","1609","2020-08-31 13:40:24","2020-11-26 14:30:33","2014-10-01 10:58:40","","","","","","","Gemmarum et lapidum historia","","","","","Claude de Marne; Jean d'Aubry","Hannover","Latin","","","","","Open WorldCat","","Hanoviae, Typis Wechelianis apud Claudium Marnium & heredes Ioannis Aubrii.","","; ","https://books.google.it/books?id=1zhgAAAAcAAJ&printsec=frontcover&hl=it&source=gbs_ge_summary_r&cad=0#v=onepage&q&f=false; https://api.digitale-sammlungen.de/iiif/presentation/v2/bsb10225850/manifest","Paracelsus; Lapidarium; Niederlande; Boodt; Rudolf II; ausgedruckt; Geographie; DB; TR_LAYOUT; TR_ONTR; TR_TRANSCRIPTION; Z_METADATA; TR_IMAGESELECTION; Z_PRIORITY2; IIIF; ONLINE","","","","","","","","","","","","","","","","","","","","","","","","","","","","","","","","","","","","","","","","","","","","","","",""
"D97I5573","book","1649","Alsted, Johann Heinrich","Scientiarum omnium Encyclopaediae: tomus quartus complectens huins Operis partem septimam. Cuius contenta ssequens folium indicabit.","","","","","","","1649","2020-08-31 13:40:24","2020-11-27 08:58:24","","","","","","","","Scientiarum omnium Encyclopaediae","","","","","Ioannis Antonii Hugretan; Marci Antonii Ravaud","lugduni","Latin","","","","","Open WorldCat","","Lugduni, Sumptibus Ioannis Antonii Hugretan Filij & Marci Antonii Ravaud, Via Mercantoria ad insigne Spherae. M.DC. XLIX, cum privilegio regis.","","","https://api.digitale-sammlungen.de/iiif/presentation/v2/bsb10325886/manifest","Magnet; Alchemie; Gilbert; Etymologie; Navigation; Enzyklopädie; Alsted; Disziplinen; DB; TR_LAYOUT; TR_ONTR; TR_TRANSCRIPTION; Z_METADATA; TR_IMAGESELECTION; IIIF; ONLINE","","","","","","","","","","","","","","","","","","","","","","","","","","","","","","","","","","","","","","","","","","","","","","",""
"22KHP62A","book","1682","Emili, Giovanni Francesco","Magneticarum motionum investigatio problema physicomathematicum, quod ex universitate parmensi P.P. Societatis Iesu publice propugnandum expoint Co io Franciscus Aemilius veronensis. Collegij Nobilium Parmensis Convictor, & inter Selectos Litterarum, ac armorum acad. Ardens.","","","","","","","1682","2020-08-31 13:40:24","2020-11-27 09:04:59","","","","","","","","Magneticarum motionum investigatio problema","","","","","Marij Vignae","Parma","Latin","","","","","Open WorldCat","","Parmae Typis Marij Vignae. MDCLXXXII. Superiorum Permissu.","","","https://books.google.it/books?id=Hvj9AGxRhmYC&dq=intitle:Magneticarum+motionum+investigatio+problema+physicomathematicum+1682&as_brr=3&redir_esc=y&hl=it","Magnet; Disputation; Jesuiten; effluvium; Liste; DB; TR_LAYOUT; TR_ONTR; TR_TRANSCRIPTION; Z_METADATA; ONLINE","","","","","","","","","","","","","","","","","","","","","","","","","","","","","","","","","","","","","","","","","","","","","","",""
"C378TTYM","book","1565","Gesner, Conrad","De Rerum fossilium, lapidum et gemmarum maxime, figuris et similitudinibus liber: non solum Medicis, sed omnibus rerum Naturae ac Phililogiae studiosis, utilies & iucundus futurus.","","","","","","","1565","2020-08-31 13:40:24","2020-11-26 13:13:42","","","","","","","","De Rerum fossilium, lapidum et gemmarum maxime","","","","","Gesnerum","Zürich","Latin","","","","","Open WorldCat","","Cum Gratia & Privilegio S. Caes. Maiestratis ad annos VII.  Tiguri M. D. LXV.","","","https://www.e-rara.ch/i3f/v20/1244108/manifest","Kompass; Abbildung; Lapidarium; Naturgeschichte; Sonnenuhr; Gesner; Kentmann; TR_LAYOUT; TR_ONTR; TR_TRANSCRIPTION; Z_METADATA; TR_IMAGESELECTION; IIIF; ONLINE","","","","","","","","","","","","","","","","","","","","","","","","","","","","","","","","","","","","","","","","","","","","","","",""
"5F3DUWEP","book","1690","Hautefeuille, Jean de; Aubry, Johann Philipp","Magnetologia curiosa: das ist, Gründtliche Abhandlung des Magneths: in zwey Abtheilungen enthalten.","","","","","","","1690","2020-08-31 13:40:24","2020-11-27 09:06:25","","","","","","","","Magnetologia curiosa","","","","","Christoph Küchlern","Mainz","German","","","","","Open WorldCat","","Mayntz/ In Verlegung des Ubersetzers: gedruckt bey Christoph Küchlern","","","https://www.e-rara.ch/i3f/v20/8162883/manifest","Magie; Magnet; Jesuiten; Übersetzung; Abbildung; Deutschland; Instrument; Populär; TR_LAYOUT; TR_ONTR; TR_TRANSCRIPTION; Z_METADATA; TR_IMAGESELECTION; IIIF; ONLINE","","","","","","","","","","","","","","","","","","","","","","","","","","","","","","","","","","","","","","","","","","","","","","",""
"WWUI4V82","book","1645","Digby, Kenelm","Two treatises: The nature of bodies; The nature of mans soule, is looked into: in way of discovery of the immortality of reasonable soules.","","","","","","","1645","2020-08-31 13:40:24","2020-11-26 15:08:07","","","","","","","","Two treatises","","","","","John Williams","London","English","","","","","Open WorldCat","","London, Printed for John William, and are to be sold at the Crowne in S. Pauls Church-yard. M. DC. XLV.","","","https://search.proquest.com/docview/2240972943/40B71861834D4BB6PQ/1?accountid=104321&imgSeq=1","Physik; Bewegung; Atom; omne quod movetur; Waffensalbe; Digby; Polarität; Anziehung; ausgedruckt; DB; TR_LAYOUT; TR_ONTR; TR_TRANSCRIPTION; Z_METADATA; ONLINE","","","","","","","","","","","","","","","","","","","","","","","","","","","","","","","","","","","","","","","","","","","","","","",""
"XKTFCYTU","book","1671","More, Henry","Enchiridion metaphysicum, sive, De rebus incorporeis succincta & luculenta dissertatio. de exsistentia & natura rerum incorporearum in genere: in qua quamplurima mundi phaenomena ad leges Cartesii mechanicas obiter expenduntur illusque philosophiae & aliorum omnino omnium qui mundana phaenomena in causas purè mechanicas solvi posse supponunt vanitas falsitasque detegitur Pars prima","","","","","","","1671","2020-08-31 13:40:24","2020-11-30 09:34:50","","","","","","","","Enchiridion metaphysicum","","","","","E. Flesher; Guilielmum Morden","London","Latin","","","","","Open WorldCat","","Londini, Typis E. Flesher. Prostat apud Gulielmum Morden, Bibliopolam Cantabrigiensen, 1671.","","","https://books.google.it/books?id=cjFknIxPPY4C&dq=intitle:Enchiridion+metaphysicum+1671&as_brr=3&redir_esc=y&hl=it","Physik; Plato; Cambridge Platoniker; Magnet; Antiperistasis; Descartes; More; Abbildung; DB; TR_LAYOUT; TR_ONTR; TR_TRANSCRIPTION; Z_METADATA; TR_IMAGESELECTION; ONLINE","","","","","","","","","","","","","","","","","","","","","","","","","","","","","","","","","","","","","","","","","","","","","","",""
"MVMHRESR","book","1674","Rohault, Jacques","Tractatus physicus Gallice emissus et recens Latinitate donatus per Th. Bonetum","","","","","","","1674","2020-08-31 13:40:24","2020-11-27 09:04:44","","","","","","","","Tractatus physicus Gallice","","","","","Ioannis Hermanni Widerhold","Geneva","Latin","","","","","Open WorldCat","","Genevae, Sumtibus Ioannis Hermanni Widerhold. M. DC. LXXIV.","","","https://books.google.it/books?id=_o5XAAAAcAAJ&dq=intitle:Tractatus+physicus+Gallice+emissus+et+recens+Latinitate+donatus+per+Th.+Bonetum+1674&as_brr=3&redir_esc=y&hl=it","Physik; Descartes; Rohault; Rezeption; materia magnetica; DB; TR_LAYOUT; TR_ONTR; TR_TRANSCRIPTION; Z_METADATA; TR_IMAGESELECTION; ONLINE","","","","Bonet, Théophile","","","","","","","","","","","","","","","","","","","","","","","","","","","","","","","","","","","","","","","","","","",""
